{"assurance":"SEMANTICALLY_REPLAY_VERIFIED_PINNED_ACTIVATION_EXPIRY_ROTATION_AND_CONSUMED_ACTION_EVIDENCE","bindings":{"activation":{"gateway_config_digest":"sha256:65e0fe737f7d094bf89d10ae5854e934ca734c8a4ea0479a6eb3b96335a8a006","lock_path":"/run/lock/aragorn-runtime-capability-activation.lock","unit_fragment_digests":{"aragorn-agent-gateway.service":"sha256:32dea7dfdf5ccb9914c46ea2aadfc88a491d6eadba5bdb8b4982d473af1a0ebe","aragorn-runtime-action-worker.service":"sha256:e231978207dd27b71ef43449cf603ac424f6129f64c8a03dd0851ddf32503723","aragorn-runtime-lineage-capability-action-broker.service":"sha256:c43a81b394e0b96b0950af94b937a79e777d7e0c815a0104f1ab45871f4afa64","aragorn-runtime-lineage-capability-observation-publisher.service":"sha256:d0f433abba94a4560c26cb99017f56543b432e2fc3aa74e3374ee4e04addeeaf"},"worker_binding_digest":"sha256:e1a2bc56ca4ce8adc52d606e79d2d1db278a75b8da2915e97f80ad8dbfb42462"},"grants":{"expired_archive_digest":"sha256:fd4a6eff5d34c1e61bf98a9b8fcf3cc477e2f70c903308bfe4c31eb0b3e4cf83","expired_state_digest":"sha256:fd4a6eff5d34c1e61bf98a9b8fcf3cc477e2f70c903308bfe4c31eb0b3e4cf83","final_consumed_state_digest":"sha256:1ef8da53377efa20bc0a9c6640812394c972f6397897eb1b2550907c8c3114f7","fresh_grant_digest":"sha256:702ac2cb64a3d90187ee75673f3542e3a5205fd765b1e960d71a12f1991313ad","short_grant_digest":"sha256:ab83519a198aa2ab25b8eb47e2763cba3ce8719e36a9156b038bcea02a360a67"},"harness":{"child_image_id":"sha256:3c8321a7118684b8358876179406da6f12fb814dcfc3a1731a923c8bb5b3fe07","harness_digest":"sha256:65d7fdbed1367c3aaac90c08afd89a6b10c1d40fbf90313a67761a0335cb5716","image_lineage_digest":"sha256:3d82195d79fcfd2da527e3a6fbe0acb20bb8860c1f8909a27c093199dfc41c6b","parent_image_id":"sha256:1afab032375efbe87ac938c0993880e164d6dace2e37239a27c6def8e320e1db","source_commit":"a6a8a8be8f868f3107adafa7c9ca5a51a7ce2044"},"implementation":{"capture_recipe_digest":"sha256:53d91dd2f7cf4bff3dc35e0d2237d293a38861fc292e457f89e9790620d92fb7","dockerfile_digest":"sha256:6080e4a51dc19ecdb46b817c75bea8d41451e7acb97190551379bdd71a37f2f2","driver_digest":"sha256:e6e1803e9593d8c1bcb1ad4a3fdf2cb5c3657f1b4bd06e65470b8ad16e9e0140","installed_closure_digest":"sha256:ca589661cd02bb069a4c1c9919469ebe1c97148a7f392f1b4317841a0e7ecc57","probe_digest":"sha256:cd4fc15f1204a97774d835c038a344466a1c7824dc9b148c2c86e69b93832f16","verifier_implementation_digest":"sha256:46e527ed0977ea5e2778cd775527515732002acf3051a580b786c8f90bcfda97","worker_installer_digest":"sha256:885441b628298629cc07d5c68e52b852864c6a755bc10d0e7e5de406f17b4748"},"parent_qualification":{"observation":{"bytes":124214,"canonical_digest":"sha256:4b668b1eae1875c6e129afd8fd0a56c4dc2e912179644bba22cc3e5a285b969e","path":"benchmark/evidence/runtime-action-worker-openclaw-systemd-composition-p3-7b-2026-08-09.json","raw_digest":"sha256:a4a9bbf375537713e72b9b8dda848202eedbf6ea3fd3a5bf8d3001297b5f82e6"},"receipt":{"bytes":5147,"canonical_digest":"sha256:a920f71e196db07b4c8aa6838e23473bd8dc5d245368c5e6285484a4d4e8fd02","path":"benchmark/receipts/phase3-runtime-action-worker-openclaw-systemd-qualification-v1-2026-08-09.json","raw_digest":"sha256:154edc574bf00bd590c77de67b32764c5ecaf8a5582092487c6aa01bd23e4eb3"},"schema_digest":"sha256:753e18cb7fd0df2eae5cb12a1b29e6e9be798162ed108114f681077d7fd2968a","verifier_digest":"sha256:68b240d19ca5625d027f5ed21520bc8a10a02a16b6c0c96908c1741b6b943812"},"runtime":{"tree_digest":"sha256:475772bbb9896a9be9b41a96f073b58eb39a4187305a83a46fad6517f86cdb2c","version":"OpenClaw 2026.7.1 (2d2ddc4)","volume":"aragorn-openclaw-2026-7-1-runtime"},"source_observation":{"authority":"BOUNDED_ACTIVATION_EXPIRY_ROTATION_OBSERVATION_ONLY_NOT_VERIFIED_RUN_EDR_INSTALLER_RELEASE_AUTHORITY","bytes":311385,"canonical_digest":"sha256:a0607801571db26cf8d2f2c07ebc6ca7675da8dbc2f385e0e64f5ab5e3187322","path":"benchmark/evidence/runtime-action-worker-activation-expiry-systemd-composition-p3-7c-2026-08-09.json","raw_digest":"sha256:b9d360c7b5b7eac5e66f79a4a2b09b70094070bc297619f499ac880663d8ad91","schema":"aragorn/runtime-action-worker-activation-expiry-systemd-observation/v1"}},"cases":{"coherent_consumed":{"driver_status":"COMPLETED","effect_status":"CREATED","grant_state":"CONSUMED","status":"PASS","verdict":"ALLOW"},"expired_fail_stop":{"activation_exit_code":1,"grant_state":"EXPIRED","route_fail_stopped":true,"status":"PASS"},"full_activation":{"boot_authority":false,"service_state":"FOUR_ACTIVE","status":"PASS"},"terminal_archive_rotation":{"archive_exact":true,"status":"PASS","transition":"EXPIRED_TO_AVAILABLE"}},"decision":{"aggregate_gate_eligible":false,"bounded_activation_expiry_evidence_eligible":true,"edr_claim_eligible":false,"installer_authority_eligible":false,"parent_p3_7b_unchanged":true,"phase3_exit_eligible":false,"public_release_eligible":false,"qualified_pair_retained_evidence_eligible":true,"run_01_eligible":false,"run_02_eligible":false,"source_observation_unchanged":true,"source_observation_verified":true,"status":"P3_7C_BOUNDED_PASS"},"limitations":["ONE_LOCAL_PRIVILEGED_DOCKER_SYSTEMD_FIXTURE_ONLY","EXACT_OPENCLAW_2026_7_1_RUNTIME_VOLUME_AND_EVALUATOR_PROVIDER_ONLY","ONE_AVAILABLE_TO_EXPIRED_TRANSITION_ONLY","ONE_OPERATOR_UNMASK_AND_TERMINAL_ARCHIVE_ROTATION_ONLY","ONE_FRESH_GRANT_AND_ONE_CREATE_ACTION_ONLY","EXPIRY_USES_LOCAL_WALL_CLOCK_WITHOUT_EXTERNAL_TIME_ATTESTATION","NO_CLOCK_STEP_SLEW_ROLLBACK_OR_EXPIRY_LATENCY_QUALIFICATION","NO_REBOOT_SYSTEMD_REEXEC_BOOT_ACTIVATION_OR_CREDENTIAL_REPROJECTION","NO_SIGKILL_POWER_LOSS_OR_FILESYSTEM_DURABILITY_FAULT_INJECTION","NO_AUTOMATIC_CONTINUOUS_REPEATED_OR_OVERLAPPING_GRANT_RENEWAL","NO_CONCURRENT_ACTIVATION_LOCK_CONTENTION_OR_PARTIAL_SYSTEMCTL_FAILURE","NO_CLAIMED_CONNECTION_ACROSS_EXPIRY_QUALIFICATION","NO_NATIVE_HOST_VM_HOSTILE_ROOT_OR_SAME_UID_DIRECTORY_ATTESTATION","SOURCE_COMMIT_SIGNATURE_TRUSTS_LOCAL_GIT_CONFIGURATION_AND_KEYRING","CONTAINER_BUILD_AND_CAPTURE_TOOLCHAIN_NOT_INDEPENDENTLY_ATTESTED","PYTHON_NODE_SYSTEMD_KERNEL_AND_NATIVE_DEPENDENCY_CLOSURE_NOT_FULLY_PINNED","PROVIDER_AND_OPENCLAW_SESSION_RAW_BYTES_NOT_RETAINED","P3_7B_PARENT_REMAINS_SEPARATE_IMMUTABLE_QUALIFICATION","SYSCALL_CAUSATION_IS_PINNED_IMPLEMENTATION_BOUND_NOT_INDEPENDENT_ATTESTATION","TRACE_PROVES_ONE_ROUTE_CONNECT_WITHOUT_RETRY_NOT_APPLICATION_SEND_COUNT","PYTHON_STDLIB_AND_DYNAMIC_VERIFIER_DEPENDENCY_CLOSURE_NOT_PINNED","RUN_01_NOT_ESTABLISHED","RUN_02_NOT_ESTABLISHED","PHASE_3_EXIT_NOT_ESTABLISHED","EDR_CLAIM_NOT_ESTABLISHED","INSTALLER_AUTHORITY_NOT_ESTABLISHED","PUBLIC_RELEASE_NOT_AUTHORIZED"],"schema":"aragorn/runtime-action-worker-activation-expiry-systemd-qualification/v1","source_recorded_at":"2026-08-09T18:38:56.247311Z"}
